{
  "id": "archive.props.l4",
  "source": "assets/source/environment/archive/candidates/archive_props_l4_v2.png",
  "kind": "environment",
  "logicalSize": {"width": 480, "height": 270},
  "pivot": {"x": 0, "y": 0},
  "layer": "L4",
  "paletteTokens": ["world.window.warm", "world.paper.archive", "world.vegetation.green"],
  "generated": [],
  "provenance": {"origin": "project-authored generated candidate ART-BATCH-001", "author": "pixel-asset-designer workflow", "license": "project-internal-generated"}
}
