{
  "id": "hub.background.l0-l2",
  "source": "assets/source/environment/hub/candidates/hub_background_l0_l2_v2.png",
  "kind": "environment",
  "logicalSize": {"width": 480, "height": 270},
  "pivot": {"x": 0, "y": 0},
  "layer": "L2",
  "paletteTokens": ["world.sky.day", "world.mountain.far", "world.water.day"],
  "generated": [],
  "provenance": {"origin": "project-authored generated candidate ART-BATCH-001", "author": "pixel-asset-designer workflow", "license": "project-internal-generated"}
}
